{
  "registry_digest": "1c89e1023264719f736303c3dcbd09c2e05e3ab7e383e4dc254ef2af9e455e46",
  "query": {
    "operation": "distribute",
    "machine_id": "SIM_BRAVO",
    "head_type": "HT_96_D_70",
    "tip_id": "st_10ul",
    "tipbox_id": "lw-4914769d0af7",
    "source_labware_id": "01KD4PYY7N4EG0E22P3QP1RHB9",
    "destination_labware_id": "lw-3918306f45b8",
    "reagent_family": "aqueous",
    "volume_ul": 10.0,
    "dispense_volumes_ul": [
      5.0,
      5.0
    ],
    "source_anchor": "A1",
    "destination_anchor": "B1"
  },
  "issues": [],
  "candidates": [
    {
      "method_id": "reference:agilent-aspirate-task",
      "version": "1.0.0",
      "status": "reference_candidate",
      "title": "Agilent Bravo aspirate task parameters",
      "derived_from": null,
      "applicability": {
        "machine_ids": [],
        "head_types": [],
        "tip_ids": [],
        "tipbox_ids": [],
        "source_labware_ids": [],
        "destination_labware_ids": [],
        "reagent_families": [],
        "operations": [
          "transfer",
          "mix",
          "distribute"
        ],
        "min_volume_ul": null,
        "max_volume_ul": null
      },
      "aspirate": {
        "liquid_class_ref": null,
        "distance_from_bottom_mm": null,
        "pre_air_ul": null,
        "post_air_ul": null,
        "dynamic_tip_extension": null,
        "tip_touch": null,
        "well_offset": null
      },
      "dispense": {
        "liquid_class_ref": null,
        "distance_from_bottom_mm": null,
        "blowout_ul": null,
        "dynamic_tip_retraction": null,
        "tip_touch": null,
        "well_offset": null
      },
      "tip_policy": null,
      "evidence": [
        {
          "source_type": "publication",
          "source_path": null,
          "source_url": "https://automation.help.agilent.com/AutomationSolutionsKB14/Bravo%20User%20Guide/QuickRef.11.11.html",
          "source_digest": null,
          "retrieved_at": "2026-10-05",
          "reviewer": null,
          "reviewed_at": null,
          "run_id": null,
          "note": "Documents selectable aspirate task parameters; it is not a qualified method for any reagent."
        }
      ],
      "revision": "534a82d3c04985d7c675dffbd51f2fa3520671ee4ef208354be0dbfcca613409",
      "missing_fields": [
        "applicability.destination_labware_ids",
        "applicability.head_types",
        "applicability.machine_ids",
        "applicability.max_volume_ul",
        "applicability.min_volume_ul",
        "applicability.reagent_families",
        "applicability.source_labware_ids",
        "applicability.tip_ids",
        "applicability.tipbox_ids",
        "aspirate.distance_from_bottom_mm",
        "aspirate.dynamic_tip_extension",
        "aspirate.liquid_class_ref",
        "aspirate.post_air_ul",
        "aspirate.pre_air_ul",
        "aspirate.tip_touch",
        "aspirate.well_offset",
        "dispense.blowout_ul",
        "dispense.distance_from_bottom_mm",
        "dispense.dynamic_tip_retraction",
        "dispense.liquid_class_ref",
        "dispense.tip_touch",
        "dispense.well_offset",
        "evidence.local_review",
        "status.review_required",
        "tip_policy"
      ],
      "execution_ready": false,
      "method_ref": {
        "method_id": "reference:agilent-aspirate-task",
        "revision": "534a82d3c04985d7c675dffbd51f2fa3520671ee4ef208354be0dbfcca613409"
      },
      "score": 58,
      "match_kind": "closest",
      "mismatches": [
        {
          "field": "machine_ids",
          "requested": "SIM_BRAVO",
          "method": [],
          "reason": "unspecified"
        },
        {
          "field": "head_types",
          "requested": "HT_96_D_70",
          "method": [],
          "reason": "unspecified"
        },
        {
          "field": "tip_ids",
          "requested": "st_10ul",
          "method": [],
          "reason": "unspecified"
        },
        {
          "field": "tipbox_ids",
          "requested": "lw-4914769d0af7",
          "method": [],
          "reason": "unspecified"
        },
        {
          "field": "source_labware_ids",
          "requested": "01KD4PYY7N4EG0E22P3QP1RHB9",
          "method": [],
          "reason": "unspecified"
        },
        {
          "field": "destination_labware_ids",
          "requested": "lw-3918306f45b8",
          "method": [],
          "reason": "unspecified"
        },
        {
          "field": "reagent_families",
          "requested": "aqueous",
          "method": [],
          "reason": "unspecified"
        }
      ]
    },
    {
      "method_id": "reference:agilent-dispense-task",
      "version": "1.0.0",
      "status": "reference_candidate",
      "title": "Agilent Bravo dispense task parameters",
      "derived_from": null,
      "applicability": {
        "machine_ids": [],
        "head_types": [],
        "tip_ids": [],
        "tipbox_ids": [],
        "source_labware_ids": [],
        "destination_labware_ids": [],
        "reagent_families": [],
        "operations": [
          "transfer",
          "distribute"
        ],
        "min_volume_ul": null,
        "max_volume_ul": null
      },
      "aspirate": {
        "liquid_class_ref": null,
        "distance_from_bottom_mm": null,
        "pre_air_ul": null,
        "post_air_ul": null,
        "dynamic_tip_extension": null,
        "tip_touch": null,
        "well_offset": null
      },
      "dispense": {
        "liquid_class_ref": null,
        "distance_from_bottom_mm": null,
        "blowout_ul": null,
        "dynamic_tip_retraction": null,
        "tip_touch": null,
        "well_offset": null
      },
      "tip_policy": null,
      "evidence": [
        {
          "source_type": "publication",
          "source_path": null,
          "source_url": "https://automation.help.agilent.com/AutomationSolutionsKB14/Bravo%20User%20Guide/QuickRef.11.12.html",
          "source_digest": null,
          "retrieved_at": "2026-10-05",
          "reviewer": null,
          "reviewed_at": null,
          "run_id": null,
          "note": "Documents selectable dispense task parameters; it is not a qualified method for any reagent."
        }
      ],
      "revision": "eb66ac4887ca0b7433362eda5d0284e4cbd989cc855090c258d28221f019cc4f",
      "missing_fields": [
        "applicability.destination_labware_ids",
        "applicability.head_types",
        "applicability.machine_ids",
        "applicability.max_volume_ul",
        "applicability.min_volume_ul",
        "applicability.reagent_families",
        "applicability.source_labware_ids",
        "applicability.tip_ids",
        "applicability.tipbox_ids",
        "aspirate.distance_from_bottom_mm",
        "aspirate.dynamic_tip_extension",
        "aspirate.liquid_class_ref",
        "aspirate.post_air_ul",
        "aspirate.pre_air_ul",
        "aspirate.tip_touch",
        "aspirate.well_offset",
        "dispense.blowout_ul",
        "dispense.distance_from_bottom_mm",
        "dispense.dynamic_tip_retraction",
        "dispense.liquid_class_ref",
        "dispense.tip_touch",
        "dispense.well_offset",
        "evidence.local_review",
        "status.review_required",
        "tip_policy"
      ],
      "execution_ready": false,
      "method_ref": {
        "method_id": "reference:agilent-dispense-task",
        "revision": "eb66ac4887ca0b7433362eda5d0284e4cbd989cc855090c258d28221f019cc4f"
      },
      "score": 58,
      "match_kind": "closest",
      "mismatches": [
        {
          "field": "machine_ids",
          "requested": "SIM_BRAVO",
          "method": [],
          "reason": "unspecified"
        },
        {
          "field": "head_types",
          "requested": "HT_96_D_70",
          "method": [],
          "reason": "unspecified"
        },
        {
          "field": "tip_ids",
          "requested": "st_10ul",
          "method": [],
          "reason": "unspecified"
        },
        {
          "field": "tipbox_ids",
          "requested": "lw-4914769d0af7",
          "method": [],
          "reason": "unspecified"
        },
        {
          "field": "source_labware_ids",
          "requested": "01KD4PYY7N4EG0E22P3QP1RHB9",
          "method": [],
          "reason": "unspecified"
        },
        {
          "field": "destination_labware_ids",
          "requested": "lw-3918306f45b8",
          "method": [],
          "reason": "unspecified"
        },
        {
          "field": "reagent_families",
          "requested": "aqueous",
          "method": [],
          "reason": "unspecified"
        }
      ]
    }
  ],
  "shared_aspiration_feasible": true
}
